1454114,GALAL ELDIN,Jaylane Shawkat Hosni,Jaylane Shawkat Hosni Galal Eldin,&W8&B$$$$$$$$$$C&&W&B$$$$$$,INDIVIDUAL,,PEP,,.,1960:01:00,
1454695,SHARIATI,Seyeed Hassan,Seyeed Hassan Shariati,42&Y&&~7$$$$$$$4&&&8$$$$$$$,LEGAL,Hojjatoleslam,PEP,Advisor and Member of the 28th Section of the Supreme Court,.,.,
1454697,MORTAZAVI,Amir,Amir Mortazavi,B&Y~&4&M7$$$$$$&B&Y$$$$$$$$,LEGAL,,PEP,Deputy Head of the Unit for Social Affairs and Crime Prevention at the judiciary in the province of Khorasan-Razavi,.,.,
1454698,ESMAILI,Gholam-Hossein,Gholam-Hossein Esmaili,&4B&&W7$$$$$$$$F&W&B&4$$$$$,INDIVIDUAL,,PEP,Head of Iran's Prisons Organisation,.,.,
1454699,ZANJIREI,Mohammad-Ali,Mohammad-Ali Zanjirei,4&BF&Y&7$$$$$$$B&2&B&8$$$$$,INDIVIDUAL,,PEP,Deputy Head of Iran's Prisons Organisation,.,.,
1454701,KHODAEI SOURI,Hojatollah,Hojatollah Khodaei Souri,4&&Y7$$$$$$$$$$2&F&~&W$$$$$,INDIVIDUAL,,PEP,Parliamentary deputy for Lorestan Province. Member of the Parliamentary Commission for Foreign and Security Policy,.,1964:00:00,Selseleh (Iran)
1454706,OMIDI,Mehrdad,Mehrdad Omidi,#B&87$$$$$$$$$$B&Y8&8$$$$$$,INDIVIDUAL,Colonel,PEP,Head of the Intelligence Services within the Iranian Police,.,.,
1454707,KAMALIAN,Behrouz,Behrouz Kamalian,3&B&W&&B$$$$$$$M&Y&&4$$$$$$,INDIVIDUAL,,,Head of the IRGC-linked 'Ashiyaneh' cyber group,.,1983:00:00,Tehran
1454708,ZARGAR,Ahmad,Ahmad Zargar,4&YF&Y$$$$$$$$$&2B_$$$$$$$$,INDIVIDUAL,Judge,PEP,Head of the 'Organisation for the Preservation of Morality,.,.,
1457536,LIBYAN AFRICAN INVESTMENT COMPANY,,Libyan African Investment Company,&MY&3&B$$$$$$$$W&M&&B$$$$$$,CORPORATE,,PEP,,.,.,
1464047,AL QADHAFI,Quren Salih Quren,Quren Salih Quren Al Qadhafi,&W3&8&M7$$$$$$$3Y&B$$$$$$$$,DIPLOMAT,,PEP,Libyan Ambassador to Chad,.,.,
1464055,AL KUNI,Amid Husain,Amid Husain Al Kuni,&W3&B7$$$$$$$$$&B&8$$$$$$$$,POLITICAL INDIVIDUAL,Colonel,PEP,Governor of Ghat (South Libya),.,.,
1466069,MANSOUR,Abdallah,Abdallah Mansour,B&B4&&Y$$$$$$$$&M8&W&$$$$$$,INDIVIDUAL,,PEP,,.,1954:07:00,
1466071,FAKHIRI,Abdelkebir Mohamad,Abdelkebir Mohamad Fakhiri,G&3&Y7$$$$$$$$$&M8&W3&$$$$$,POLITICAL INDIVIDUAL,,PEP,"Minister for Education, Higher Education and Research in Colonel Qadhafi's Government",.,1963:05:00,
1466072,AL-CHARIF,Ibrahim Zarroug,Ibrahim Zarroug Al-Charif,&WJ2&Y&M$$$$$$$&MY&2&B$$$$$,POLITICAL INDIVIDUAL,,PEP,Minister for Social Affairs in Colonel Qadhafi's Government,.,.,
1466073,AL-GAOUD,Abdelmajid,Abdelmajid Al-Gaoud,&WF&&&8$$$$$$$$&M8&WB&$$$$$,POLITICAL INDIVIDUAL,,PEP,"Minister for Agriculture, Animal and Maritime Resources in Colonel Qadhafi's Government",.,1943:00:00,
1466074,HOUEJ,Mohamad Ali,Mohamad Ali Houej,2&&&F$$$$$$$$$$B&2&B&8$$$$$,POLITICAL INDIVIDUAL,,PEP,"Minister for Industry, Economy and Trade in Colonel Qadhafi's Government",.,1949:00:00,"Al-Azizia (near Tripoli); Al-Azizia (near Tripoli), Libya"
1466239,WAATASSIMOU FOUNDATION,,Waatassimou Foundation,G&&B8&~&&B$$$$$L&~&4&B$$$$$,ORGANISATION,,,,.,.,
1466244,LIBYAN JAMAHIRIYA BROADCASTING CORPORATION,,Libyan Jamahiriya Broadcasting Corporation,3&YM&Y&~&&$$$$$W&M&&B$$$$$$,CORPORATE,,PEP,,.,.,
1466249,REVOLUTIONARY GUARD CORPS,,Revolutionary Guard Corps,3&YM$$$$$$$$$$$Y&M&W&~$$$$$,ORGANISATION,,PEP,,.,.,
1473521,LAP GREEN NETWORKS,,Lap Green Networks,P&~L&Y3$$$$$$$$W$$$$$$$$$$$,CORPORATE,,PEP,,.,.,
1478786,RABI,Fazl,Fazl Rabi,Y&M7$$$$$$$$$$$G&4W$$$$$$$$,TERRORISM,,,Senior official in Konar Province during the Taliban regime,.,1972:00:00,"Kohe Safi District, Parwan Province, Afghanistan; Kapisa Province, Afghanistan; Nangarhar Province, Afghanistan; Kabul Province, Afghanistan"
1479293,SO,Tong Myong,Tong Myong So,4#$$$$$$$$$$$$$~&BFB&&$$$$$,INDIVIDUAL,,PEP,President of Korea National Insurance Corporation (KNIC),.,1956:09:00,
1480261,KHALILI,Ali,Ali Khalili,3&W&W7$$$$$$$$$&W7$$$$$$$$$,TERRORISM,General,PEP,IRGC General,.,.,
1480291,MOTLAGH,Bahram Hosseini,Bahram Hosseini Motlagh,B&~W&F$$$$$$$$$M&Y&B$$$$$$$,TERRORISM,Commander,PEP,Head of the Army Command and General Staff College (DAFOOS),.,.,
1480322,AL-INMA HOLDING CO FOR SERVICES INVESTMENTS,,Al-Inma Holding Co For Services Investments,2&W8&BF$$$$$$$$&W&B&$$$$$$$,CORPORATE,,PEP,,.,.,
1480323,AL-INMA HOLDING CO FOR INDUSTRIAL INVESTMENTS,,Al-Inma Holding Co For Industrial Investments,2&W8&BF$$$$$$$$&W&B&$$$$$$$,CORPORATE,,PEP,,.,.,
1480324,AL-INMA HOLDING COMPANY FOR TOURISM INVESTMENT,,Al-Inma Holding Company For Tourism Investment,2&W8&BF$$$$$$$$&W&B&$$$$$$$,CORPORATE,,PEP,,.,.,
1480326,AL-INMA HOLDING CO FOR CONSTRUCTION AND REAL ESTATE DEVELOPMENTS,,Al-Inma Holding Co For Construction And Real Estate Developments,Y&W$$$$$$$$$$$$&W&B&$$$$$$$,CORPORATE,,PEP,,.,.,
1480328,SABTINA LTD,,Sabtina Ltd,4&M~&B&$$$$$$$$$$$$$$$$$$$$,CORPORATE,,PEP,,.,.,
1480419,SOLTANI,Hodjatoleslam Seyed Mohammad,Hodjatoleslam Seyed Mohammad Soltani,4&W~&B7$$$$$$$$2&8F&~&$$$$$,LEGAL,Judge,PEP,Head of the Organisation for Islamic Propaganda in the province of Khorasan-Razavi,.,.,
1480432,BAROQUE INVESTMENTS LIMITED,,Baroque Investments Limited,&BM&4~B&B~$$$$$M&Y&3$$$$$$$,CORPORATE,,PEP,,.,.,
1480433,KINLOSS PROPERTY LIMITED,,Kinloss Property Limited,3&BW&4$$$$$$$$$$$$$$$$$$$$$,CORPORATE,,PEP,,.,.,
1480435,CAPITANA SEAS LIMITED,,Capitana Seas Limited,4&4$$$$$$$$$$$$3&M&~&B$$$$$,CORPORATE,,PEP,,.,.,
1480437,ASHTON GLOBAL INVESTMENTS LIMITED,,Ashton Global Investments Limited,&BM&4~B&B~$$$$$&42~&B$$$$$$,CORPORATE,,PEP,,.,.,
1480519,SALAVATI,Abdolghassem,Abdolghassem Salavati,4&W&M&~7$$$$$$$&M8&WF&$$$$$,LEGAL,Judge,PEP,"Judge, Head of Tehran Revolutionary Court",.,.,
1480522,SHARIFI,Malek Ajdar,Malek Ajdar Sharifi,42&Y&M7$$$$$$$$B&W&3$$$$$$$,LEGAL,Hojjatoleslam,PEP,Judge at the Supreme Court,.,.,
1480544,YASAGHI,Ali-Akbar,Ali-Akbar Yasaghi,#4&F7$$$$$$$$$$&W&&3M&$$$$$,LEGAL,Judge,PEP,"Judge, Mashhad Revolutionary Court",.,.,
1480547,BOZORGNIA,Mostafa,Mostafa Bozorgnia,M&4&YFB&&$$$$$$B&4~&M&$$$$$,INDIVIDUAL,,PEP,Head of ward 350 of Evin Prison,.,.,
1480554,SEDAQAT,Farajollah,Farajollah Sedaqat,4&8&3&~$$$$$$$$G&Y&F&W$$$$$,INDIVIDUAL,,PEP,Assistant Secretary of the General Prison Administration in Tehran,.,.,
1480930,AL-NASSER,Hala Mohammad,Hala Mohammad Al-Nasser,&WB&4&Y$$$$$$$$2&W&$$$$$$$$,POLITICAL INDIVIDUAL,,PEP,Minister of Tourism,.,1964:00:00,"Raqqa, Syria"
1481008,AWWAD,Tayseer Qala,Tayseer Qala Awwad,&L&8$$$$$$$$$$$~&&4&Y$$$$$$,POLITICAL INDIVIDUAL,Judge,PEP,Former Minister for Justice,.,1943:00:00,"Damascus; alt POB: Damascus, Syria; Damaskus; Damascus, Syrian Arab Republic"
1481088,AL-SHAAR,Mohammad Ibrahim,Mohammad Ibrahim Al-Shaar,&W42&Y$$$$$$$$$B&2&B&8$$$$$,POLITICAL INDIVIDUAL,Major General,PEP,Minister of the Interior,.,1950:00:00,"Lattakia Province, Syria; alt POB's Latiqiyah, Syria; Aleppo; Aleppo, Syrian Arab Republic"
1481108,AL-JLEILATI,Mohammad,Mohammad Al-Jleilati,&WFW&W&~7$$$$$$B&2&B&8$$$$$,POLITICAL INDIVIDUAL,Dr,PEP,Minister of Finance,.,1945:00:00,"Damascus, Syria; Damascus; Damascus, Syrian Arab Republic"
1481126,AL-SHAAR,Mohammad Nidal,Mohammad Nidal Al-Shaar,&W42&Y$$$$$$$$$B&2&B&8$$$$$,POLITICAL INDIVIDUAL,Dr,PEP,Former Minister for Economy and Trade,.,1956:00:00,"Aleppo; alt Aleppo, Syria; Aleppo, Syrian Arab Republic"
1481140,AL-RASHED,Saleh,Saleh Al-Rashed,4&W$$$$$$$$$$$$&WY&42&$$$$$,POLITICAL INDIVIDUAL,Dr,PEP,Former Minister for Education,.,1964:00:00,"Aleppo, Syria; Alt POB: Aleppo Province; Aleppo Province, Syrian Arab Republic"
1481150,AL-HALQI,Wael Nader,Wael Nader Al-Halqi,&W&W37$$$$$$$$$L&&W$$$$$$$$,POLITICAL INDIVIDUAL,Dr,PEP,Minister of Health,.,1964:00:00,"Daraa, Syria; alt. POB: Daraa Province; Daraa Province, Syrian Arab Republic"
1481171,ABBAS,Fayssal,Fayssal Abbas,&M&$$$$$$$$$$$$G&&4&W$$$$$$,POLITICAL INDIVIDUAL,Dr,PEP,Former Minister for Transport,.,1955:00:00,"Hamah, Syria; Hama Province; Hama Province, Syrian Arab Republic"
1481215,KHAMIS,Imad Mohammad Deeb,Imad Mohammad Deeb Khamis,3&B&4$$$$$$$$$$&B&8$$$$$$$$,POLITICAL INDIVIDUAL,,PEP,Minister of Electricity,.,1961:08:00,"near Damascus, Syria; alt. POB near Damascus; near Damascus, Syrian Arab Republic"
1481284,MAHMOUD,Adnan Hassan,Adnan Hassan Mahmoud,B&B&&8$$$$$$$$$&8B&B$$$$$$$,POLITICAL INDIVIDUAL,Dr,PEP,Former Minister for Information,.,1966:00:00,"Tartous; alt POB: Tartous, Syria; Tartus; Tartous, Syrian Arab Republic"
1481290,SLAKHO,Adnan,Adnan Slakho,4W&3@$$$$$$$$$$&8B&B$$$$$$$,POLITICAL INDIVIDUAL,Dr,PEP,Former Minister for Industry,.,1955:00:00,"Damascus, Syria; Alt POB: Damascus; Damascus, Syrian Arab Republic"
1487883,ANTONOV,Anatoly Ivanovich,Anatoly Ivanovich Antonov,&B~&B&M$$$$$$$$&B&~&W7$$$$$,POLITICAL INDIVIDUAL,,PEP,"Deputy Minister of Defence, Russian Federation",.,1955:05:00,"Omsk, Russian Federation; Omsk"
1488063,NAJIB,Atif,Atif Najib,P&F&M$$$$$$$$$$&~&M$$$$$$$$,MILITARY,Brigadier General,PEP,Former Head of the Syrian Political Security Directorate for Dar'a Province,.,.,"Jablah, Syria"
1488067,SYRIAN GENERAL INTELLIGENCE DIRECTORATE,,Syrian General Intelligence Directorate,4&Y&&B$$$$$$$$$$$$$$$$$$$$$,ORGANISATION,,PEP,,.,.,
1490832,YUN,Jong-rin,Jong-Rin Yun,#B$$$$$$$$$$$$$C&BFY&B$$$$$,MILITARY,General,PEP,Senior Military Official,.,1938:00:00,
1493363,ZAITOUN,Mohammed Dib,Mohammed Dib Zaitoun,4&&~&&B$$$$$$$$B&2&B&8$$$$$,POLITICAL INDIVIDUAL,Major General,PEP,Head of General Security Directorate,.,1952:00:00,"Damascus; Damascus, Syrian Arab Republic"
1493374,AL-ABBAS,Amjad,Amjad Al-Abbas,&W&M&4$$$$$$$$$&BF&8$$$$$$$,POLITICAL INDIVIDUAL,,PEP,Head of Political Security in Banyas,.,.,
1493387,QUDSIYAH,Abdul Fatah,Abdul Fatah Qudsiyah,3L84&&&$$$$$$$$&M8#$$$$$$$$,MILITARY,Major General,PEP,Head of Syrian Military Intelligence,.,1950:00:00,"Hama; Hama, Syrian Arab Republic"
1493393,HASSAN,Jamil,Jamil Hassan,2&4&B$$$$$$$$$$C&B&W$$$$$$$,MILITARY,Major General,PEP,Head of Syrian Air Force Intelligence,.,1953:00:00,Syria
1494854,SYTROL,,Sytrol,4&~Y&W$$$$$$$$$$$$$$$$$$$$$,CORPORATE,,PEP,,.,.,
1496408,GENERAL PETROLEUM CORPORATION,,General Petroleum Corporation,3&YM&Y&~&&$$$$$N&~Y&W&$$$$$,CORPORATE,,PEP,,.,.,
1501391,SYRIAN NATIONAL SECURITY BUREAU,,Syrian National Security Bureau,M&Y&&#$$$$$$$$$4&Y&&B$$$$$$,ORGANISATION,,PEP,,.,.,
1501405,CHAM HOLDING,,Cham Holding,2&W8&BF$$$$$$$$J2&B$$$$$$$$,CORPORATE,,,,.,.,
1501408,BENA PROPERTIES,,Bena Properties,M&B&$$$$$$$$$$$$$$$$$$$$$$$,CORPORATE,,,,.,.,
1501412,AL MASHREQ INVESTMENT FUND,,Al Mashreq Investment Fund,B&42Y&3$$$$$$$$&WW$$$$$$$$$,CORPORATE,,,,.,.,
1501682,ACHWAN,Mochammad,Mochammad Achwan,&J2L&B$$$$$$$$$B&J2&B&$$$$$,TERRORISM,,,,.,1948:05:00,"Tulungagung, Indonesia"
1504839,JUWADI,Taher,Taher Juwadi,C&L&87$$$$$$$$$~&2&Y$$$$$$$,MILITARY,Colonel,PEP,Fourth in Revolutionary Guard chain of command,.,.,
1504999,MAAA SYNERGY,,Maaa Synergy,4&B&YF7$$$$$$$$B&$$$$$$$$$$,CORPORATE,,,,.,.,
1505019,MODERN TECHNOLOGIES FZC (MTFZC),,Modern Technologies Fzc (Mtfzc),$$$$$$$$$$$$$$$B&8&YB$$$$$$,CORPORATE,,,,.,.,
1505119,MAKHLOUF,Iyad,Iyad Makhlouf,B&3W&&M$$$$$$$$&&&8$$$$$$$$,INDIVIDUAL,,PEP,GID Officer,.,1973:01:00,"Damascus; Damascus, Syrian Arab Republic"
1505125,ARAN MODERN DEVICES (AMD),,Aran Modern Devices (Amd),8&M&4$$$$$$$$$$&Y&B$$$$$$$$,CORPORATE,,,,.,.,
1505148,ARAS FARAYANDE,,Aras Farayande,G&Y&&&B8$$$$$$$&Y&$$$$$$$$$,CORPORATE,,,,.,.,
1505155,AL-HASSAN,Bassam,Bassam Al-Hassan,&W&4&B$$$$$$$$$M&4&B$$$$$$$,POLITICAL INDIVIDUAL,Brigadier General,PEP,Brigadier General;Syrian Presidential Advisor,.,1961:00:00,"Homs, Syria"
1505297,NEKA NOVIN,,Neka Novin,P&M&B$$$$$$$$$$P&3&$$$$$$$$,CORPORATE,,,,.,.,
1505309,NOAVARAN POOYAMOJ,,Noavaran Pooyamoj,N&&&B&F$$$$$$$$P&&M&Y&$$$$$,CORPORATE,,,,.,.,
1505353,SUN MIDDLE EAST FZ COMPANY,,Sun Middle East Fz Company,&4~$$$$$$$$$$$$4&B$$$$$$$$$,CORPORATE,,,,.,.,
1505370,ASHTIAN TABLO,,Ashtian Tablo,~&MW@$$$$$$$$$$&42~&&B$$$$$,CORPORATE,,,,.,.,
1505379,BALS ALMAN,,Bals Alman,M&W4$$$$$$$$$$$&WB&B$$$$$$$,CORPORATE,,,,.,.,
1505386,RAAD IRAN,,Raad Iran,&Y&B$$$$$$$$$$$Y&8$$$$$$$$$,CORPORATE,,,,.,.,
1505412,HIRBOD CO,,Hirbod Co,2&YM&8$$$$$$$$$$$$$$$$$$$$$,CORPORATE,,,,.,.,
1505458,MARO SANAT COMPANY,,Maro Sanat Company,4&B&~$$$$$$$$$$B&Y@$$$$$$$$,CORPORATE,,,,.,.,
1505887,POLITICAL SECURITY DIRECTORATE,,Political Security Directorate,8&Y&3~&Y&~$$$$$N&W&~&3$$$$$,ORGANISATION,,PEP,,.,.,
1505895,SYRIAN MINISTRY OF THE INTERIOR,,Syrian Ministry Of The Interior,B&B&4~Y7$$$$$$$4&Y&&B$$$$$$,ORGANISATION,,PEP,,.,.,
1507776,CUSPERT,Denis Mamadou,Denis Mamadou Cuspert,3&4M&Y~$$$$$$$$8P4$$$$$$$$$,TERRORISM,,,,.,1975:10:00,"Berlin, Germany"
1508927,SAD IMPORT EXPORT COMPANY,,Sad Import Export Company,&BM&Y~$$$$$$$$$4$$$$$$$$$$$,CORPORATE,,,,.,.,
1512319,AL FURAT PETROLEUM COMPANY,,Al Furat Petroleum Company,N&~Y&W&&B$$$$$$&WM&Y&~$$$$$,CORPORATE,,PEP,,.,.,
1512441,MU'ZI HNEIDI,Said,Said Mu'Zi Hneidi,B&47$$$$$$$$$$$4&&8$$$$$$$$,POLITICAL INDIVIDUAL,,PEP,Minister of Oil and Mineral Resources,.,1954:00:00,"Damascus, Syria"
1513068,DEIR EZ-ZUR PETROLEUM COMPANY,,Deir Ez-Zur Petroleum Company,N&~Y&W&&B$$$$$$8&Y$$$$$$$$$,CORPORATE,,PEP,,.,.,
1513245,DIJLA PETROLEUM COMPANY,,Dijla Petroleum Company,N&~Y&W&&B$$$$$$8&FW&$$$$$$$,CORPORATE,,PEP,,.,.,
1518069,EBLA PETROLEUM COMPANY,,Ebla Petroleum Company,N&~Y&W&&B$$$$$$&MW&$$$$$$$$,CORPORATE,,PEP,,.,.,
1524008,GHEZEL AYAGH,Alireza,Alireza Ghezel Ayagh,&&&F$$$$$$$$$$$&W&Y&4&$$$$$,INDIVIDUAL,Captain,,CEO,.,1979:03:00,"Kerman, Iran"
1524010,MOGHADDAMI FARD,Mohammad,Mohammad Moghaddami Fard,G&Y8$$$$$$$$$$$B&2&B&8$$$$$,INDIVIDUAL,,PEP,Former Regional Director,.,1956:07:00,
1524013,TAFAZOLI,Ahmad,Ahmad Tafazoli,~&M&4&W7$$$$$$$&2B_$$$$$$$$,INDIVIDUAL,,PEP,Managing Director of IRISL China Shipping Company,.,1956:05:00,"Bojnord, Iran"
1524879,AKHUND,Mohammad Aman,Mohammad Aman Akhund,&3&B8$$$$$$$$$$B&2&B&8$$$$$,TERRORISM,Mullah,,,.,1970:00:00,"Bande Tumur Village, Maiwand District, Qandahar Province, Afghanistan; Bande Tumur Village, Maiwand District, Kandahar Province, Afghanistan"
1524881,WAZIR,Ahmed Jan,Ahmed Jan Wazir,L&4&Y$$$$$$$$$$&2B_$$$$$$$$,TERRORISM,,,Official of the Ministry of Finance during the Taliban regime,.,1963:00:00,"Barlah Village, Qareh Bagh District, Ghazni Province, Afghanistan;Barlach Village, Qareh Bagh District, Ghazni Province, Afghanistan"
1526584,BEHNAM SHAHRIYARI TRADING COMPANY,,Behnam Shahriyari Trading Company,42&Y&&&Y7$$$$$$M&B&B$$$$$$$,TERRORISM,,,,.,.,
1526816,CHALICHE,Zoulhima,Zoulhima Chaliche,J2&W&J2$$$$$$$$4&&W&B&$$$$$,POLITICAL INDIVIDUAL,Hojjatoleslam,PEP,Head of presidential security,.,1951:00:00,Kerdaha
1526831,CHALICHE,Riyad,Riyad Chaliche,J2&W&J2$$$$$$$$Y&&&8$$$$$$$,POLITICAL INDIVIDUAL,,PEP,Director of Military Housing Establishment,.,.,
1526871,QADDUR,Khalid,Khalid Qaddur,3&8&Y$$$$$$$$$$3&W&8$$$$$$$,INDIVIDUAL,,PEP,Leading businessperson operating in Syria,.,.,
1526891,AL-QUWATLY,Ra'if,Ra'If Al-Quwatly,&W3L&~W7$$$$$$$Y$$$$$$$$$$$,INDIVIDUAL,,PEP,Business associate of Maher Al-Assad and responsible for managing some of his business interests,.,1967:02:00,"Damascus; Damascus, Syrian Arab Republic"
1526925,HAMSHO INTERNATIONAL GROUP,,Hamsho International Group,2&B42@$$$$$$$$$$$$$$$$$$$$$,CORPORATE,,PEP,,.,.,
1526943,MILITARY HOUSING ESTABLISHMENT,,Military Housing Establishment,&4~&MW&42B$$$$$B&W&~&Y$$$$$,CORPORATE,,PEP,,.,.,
1530059,CHERNOMORNEFTEGAZ,,Chernomorneftegaz,J2&YB&B&YB$$$$$$$$$$$$$$$$$,CORPORATE,,PEP,,.,.,
1532586,CHATAYEV,Akhmed,Akhmed Chatayev,J2&~&&&M$$$$$$$&3B&8$$$$$$$,TERRORISM,,,,.,1980:07:00,"Vedeno Village, Vedenskiy District, the Republic of Chechnya, Russia; Vedeno, Vedeno district, CHIASSR, Russian Federation; alt. POB Vedeno Village, Vedenskiy District, Republic of Chechnya, Russian Federation"
1535763,AKSYONOV,Sergey Valeryevich,Sergey Valeryevich Aksyonov,&34&&B&M$$$$$$$4&YF7$$$$$$$,POLITICAL INDIVIDUAL,,PEP,Prime Minister of Crimea,.,1972:11:00,"Balti, Moldova; Belti, Moldova; Beltsy, Moldova; Beltsy (Balti) , Moldova; Beltsy, now Republic of Moldova; Beltsy (Balti), Republic of Moldova"
1538981,TEMIRGALIEV,Rustam Ilmirovich,Rustam Ilmirovich Temirgaliev,~&B&YF&W&&$$$$$Y&4~&B$$$$$$,POLITICAL INDIVIDUAL,,PEP,Deputy Chairman of the Council of Ministers of Crimea,.,1976:08:00,"Ulan-Ude, Russia; alt. POB Ulan-Ude, Russian Federation; Ulan-Ude, Buryat ASSR (Russian SFSR); Ulan-Ude, Buryat, Russian Federation"
1552549,OMAR,Hassan Mahat,Hassan Mahat Omar,#B&Y$$$$$$$$$$$2&4&B$$$$$$$,INDIVIDUAL,,,,.,1979:04:00,"Garissa, Kenya"
1553482,MUFLEH,Mohammad,Mohammad Mufleh,B&MW$$$$$$$$$$$B&2&B&8$$$$$,MILITARY,,PEP,Head of Syrian Military Intelligence in the town of Hama,.,.,
1553501,YOUNES,Tawfiq,Tawfiq Younes,#B&4$$$$$$$$$$$~&&M&3$$$$$$,MILITARY,Major General,PEP,Head of the Department for Internal Security General Intelligence Directorate,.,.,
1553510,JABER,Ayman,Ayman Jaber,C&M&Y$$$$$$$$$$&&B&B$$$$$$$,TERRORISM,,,Senior Executive,.,1967:01:00,"Latakia; Latakia, Syrian Arab Republic"
1553685,MAKHLUF,Muhammad,Muhammad Makhluf,B&3W&M$$$$$$$$$B&2&B&8$$$$$,INDIVIDUAL,,,,.,1932:10:00,"Latakia, Syria; Latakia, Syrian Arab Republic"
1556955,KLYMENKO,Oleksandr Viktorovych,Oleksandr Viktorovych Klymenko,3W&B&B3@$$$$$$$#W&34&B$$$$$,POLITICAL INDIVIDUAL,,PEP,Former Minister of Revenues and Charges,.,1980:11:00,"Makiyivka, Donetsk Region, Ukraine; Makiivka (Donetsk oblast); Makiivka, Donetsk oblast"
1558595,SHAMS,Abolghassem Mozaffari,Abolghassem Mozaffari Shams,42&B$$$$$$$$$$$&M&WF&4$$$$$,INDIVIDUAL,,PEP,Head of Khatam Al-Anbia Construction Headquarters,.,1967:00:00,
1562387,AL-ADNANI,Abu Mohammed,Abu Mohammed Al-Adnani,&W&8B&B7$$$$$$$&M#$$$$$$$$$,TERRORISM,,,,.,1977:00:00,"Banash, Syria; Binnish, Syrian Arab Republic; Banash, Aleppo, Syria"
1568305,AL-ASSAD,Hayel,Hayel Al-Assad,&W&4&8$$$$$$$$$2&&&W$$$$$$$,MILITARY,,PEP,Head of the Military Police Unit (4th Division),.,.,
1568318,AL-SALIM,Ali,Ali Al-Salim,&W4&W&B$$$$$$$$&W7$$$$$$$$$,INDIVIDUAL,,PEP,Director of the supplies office (Syrian Ministry of Defence),.,.,
1568324,AL-ASSAD,Nizar,Nizar Al-Assad,&W&4&8$$$$$$$$$P&4&Y$$$$$$$,INDIVIDUAL,,PEP,,.,.,
1568331,SHAHADAH,Rafiq,Rafiq Shahadah,42&2&8&$$$$$$$$Y&M&3$$$$$$$,MILITARY,Brigadier General,PEP,Former Head of Syrian Military Intelligence (SMI) Branch 293 (Internal Affairs) in Damascus,.,.,
1568337,MILITARY INTELLIGENCE DIRECTORATE,,Military Intelligence Directorate,B&W&~&Y7$$$$$$$$$$$$$$$$$$$,ORGANISATION,,PEP,,.,.,
1568343,AIR FORCE INTELLIGENCE AGENCY,,Air Force Intelligence Agency,G&Y4$$$$$$$$$$$$$$$$$$$$$$$,ORGANISATION,,PEP,,.,.,
1568352,BUKHAYTAN,Muhammad Said,Muhammad Said Bukhaytan,M&3&&~&B$$$$$$$B&2&B&8$$$$$,POLITICAL INDIVIDUAL,,PEP,Assistant Regional Secretary of Baath Arab Socialist Party,.,.,
1568362,DOUBA,Ali,Ali Douba,8&&M&$$$$$$$$$$&W7$$$$$$$$$,INDIVIDUAL,,PEP,Special Advisor to President Bashar Al-Assad,.,1933:00:00,"Karfis, Syria; Karfis, Syrian Arab Republic"
1568367,AL-HUSAYN,Nawful,Nawful Al-Husayn,&W&4&&B$$$$$$$$P&&M&W$$$$$$,MILITARY,Brigadier General,PEP,Idlib Syrian Military Intelligence (SMI) Branch Chief.,.,.,
1568368,HASSAN,Samir,Samir Hassan,2&4&B$$$$$$$$$$4&B&Y$$$$$$$,INDIVIDUAL,,,Leading businessperson operating in Syria,.,.,
1568379,SUKKAR,Husam,Husam Sukkar,4&3&Y$$$$$$$$$$2&4&B$$$$$$$,POLITICAL INDIVIDUAL,Brigadier,PEP,Presidential Adviser on Security Affairs,.,.,
1568386,ZAMRINI,Muhammed,Muhammed Zamrini,4&BY&B7$$$$$$$$B&2&B&8$$$$$,MILITARY,Brigadier General,PEP,Branch Chief for Syrian Military Intelligence (SMI) in Homs,.,.,
1568394,JABER,Mohammad,Mohammad Jaber,C&M&Y$$$$$$$$$$B&2&B&8$$$$$,INDIVIDUAL,,,,.,1957:01:00,"Latakia, Syria;Latakia; Latakia, Syrian Arab Republic"
1568410,KHALIL,Ghassan,Ghassan Khalil,3&W&W$$$$$$$$$$F&4&B$$$$$$$,MILITARY,Brigadier General,PEP,Head of General Intelligence Directorate's (GID) Information Branch,.,.,
1568444,ADANOV,Munir,Munir Adanov,&8&B&M$$$$$$$$$B&B&Y$$$$$$$,MILITARY,Lieutenant General,PEP,Deputy Chief of General Staff of the Syrian Army,.,1951:00:00,
1571907,MALOFEYEV,Konstantin,Konstantin Malofeyev,B&W&M&&&M$$$$$$3&B4~&B$$$$$,INDIVIDUAL,,PEP,Managing Partner of Marshall Capital Partners,.,1974:07:00,"Pushchino, Moscow, Russia; Pushchino, Moscow Region, Russian Federation; Puschino"
1572705,COTTON MARKETING ORGANISATION,,Cotton Marketing Organisation,3&~&B$$$$$$$$$$$$$$$$$$$$$$,CORPORATE,,PEP,,.,.,
1574175,BUSINESS LAB,,Business Lab,W&M$$$$$$$$$$$$$$$$$$$$$$$$,CORPORATE,,,,.,.,
1575358,CHEHABI,Fares,Fares Chehabi,J2&2&M7$$$$$$$$G&Y$$$$$$$$$,INDIVIDUAL,,,President of Aleppo Chamber of Industry,.,1972:05:00,
1575361,CHAM INVESTMENT GROUP,,Cham Investment Group,J2&B$$$$$$$$$$$$$$$$$$$$$$$,CORPORATE,,,,.,.,
1575363,ANBOUBA,Issam,Issam Anbouba,&BM&&M&$$$$$$$$&4&B$$$$$$$$,INDIVIDUAL,,,President of Anbouba for Agricultural Industries Co.,.,1952:00:00,"Lattakia, Syria; Alt. POB's: Latakia, Syria; Homs, Syria; Homs, Syrian Arab Republic"
1575365,MADA TRANSPORT,,Mada Transport,B&8&$$$$$$$$$$$$$$$$$$$$$$$,CORPORATE,,,,.,.,
1575672,GENERAL ORGANISATION OF TOBACCO,,General Organisation Of Tobacco,~&M&3@$$$$$$$$$#YF&B&4$$$$$,CORPORATE,,PEP,,.,.,
1589255,AL-DUNYA TELEVISION,,Al-Dunya Television,&W8&B&&$$$$$$$$$$$$$$$$$$$$,CORPORATE,,,,.,.,
1589257,EL-TEL CO,,El-Tel Co,&W~&W$$$$$$$$$$$$$$$$$$$$$$,CORPORATE,,,,.,.,
1589260,RAMAK CONSTRUCTION CO,,Ramak Construction Co,3&B4~Y&3~&$$$$$Y&B&3$$$$$$$,CORPORATE,,,,.,.,
1589262,SOURUH COMPANY,,Souruh Company,4&&Y#$$$$$$$$$$$$$$$$$$$$$$,CORPORATE,,,,.,.,
1591914,IQBAL,Zafar,Zafar Iqbal,&3M&W$$$$$$$$$$4&M&Y$$$$$$$,TERRORISM,Professor,,,.,1953:10:00,"Masjid al-Qadesia, 4 Lake Road, Lahore, Pakistan"
1592853,ABBASIN,Abdul Aziz,Abdul Aziz Abbasin,&M&4&B$$$$$$$$$&M8#$$$$$$$$,TERRORISM,,,,.,1969:00:00,"Sheykhan Village, Pirkowti Area, Orgun District, Paktika Province, Afghanistan; Village, Pirkowti Area, Orgun District, Paktika Province, Afghanistan"
1592881,REHMAN,Abdur,Abdur Rehman,Y&B&B$$$$$$$$$$&M8&Y$$$$$$$,TERRORISM,,,,.,1965:10:00,"Mirpur Khas, Pakistan"
1592882,NOORZAI,Hajji Malik,Hajji Malik Noorzai,P&Y4&7$$$$$$$$$2&F7$$$$$$$$,TERRORISM,Haji,,,.,1957:00:00,"Chaman border town, Pakistan; Pishin, Baluchistan Province, Pakistan; Pishin, Baluchistan. Province, Pakista"
1592883,NOORZAI,Hajji Faizullah Khan,Hajji Faizullah Khan Noorzai,P&Y4&7$$$$$$$$$2&F7$$$$$$$$,TERRORISM,Haji,,,.,1966:00:00,"Lowy Kariz, Spin Boldak District, Kandahar Province, Afghanistan; Kadanay, Spin Boldak District, Kandahar Province, Afghanistan; Lowy kariz, Spin Bolak District, Kandahar Province, Afghanistan; Chaman, Baluchistan Province, Pakistan"
1592887,RAHIM,Fazal,Fazal Rahim,Y&2&B$$$$$$$$$$G&4&W$$$$$$$,TERRORISM,,,,.,1974:01:00,"Kabul, Afghanistan"
1601104,SHAKURI,Gholam,Gholam Shakuri,42&3&Y7$$$$$$$$F&W&B$$$$$$$,TERRORISM,,,,.,1964:00:00,"Tehran, Iran"
1601122,ABDOLLAHI,Hamed,Hamed Abdollahi,&M8&W&27$$$$$$$2&B&8$$$$$$$,TERRORISM,,,,.,1960:08:00,Iran
1601124,ARBABSIAR,Manssor,Manssor Arbabsiar,&YM&M4&&Y$$$$$$B&B4&Y$$$$$$,TERRORISM,,,,.,1955:03:00,Iran
1601568,BAGHERI,Mohammad-Bagher,Mohammad-Bagher Bagheri,M&F&Y7$$$$$$$$$B&2&B&8$$$$$,INDIVIDUAL,,,Vice-chairman of the judiciary administration of South Khorasan province,.,.,
1601590,HAJMOHAMMADI,Aziz,Aziz Hajmohammadi,2&FB&2&B&8$$$$$&4&4$$$$$$$$,LEGAL,,PEP,Judge at branch 71 (Tehran Provincial Criminal Court),.,.,
1601649,AKHARIAN,Hassan,Hassan Akharian,&3&Y&&B$$$$$$$$2&4&B$$$$$$$,INDIVIDUAL,,,"Keeper of Ward 1 of Radjaishahr prison, Karadj",.,.,
1601682,MALEKI,Mojtaba,Mojtaba Maleki,B&W&37$$$$$$$$$B&F~&M&$$$$$,LEGAL,,PEP,Prosecutor of Kermanshah,.,.,
1601684,BANESHI,Jaber,Jaber Baneshi,M&B&427$$$$$$$$C&M&Y$$$$$$$,LEGAL,,PEP,Prosecutor of Shiraz,.,.,
1601697,KHALILOLLAHI,Moussa,Moussa Khalilollahi,3&W&W&W&27$$$$$B&&4&$$$$$$$,LEGAL,,PEP,Prosecutor of Tabriz,.,.,
1601732,GANJI,Mostafa Barzegar,Mostafa Barzegar Ganji,F&BF7$$$$$$$$$$B&4~&M&$$$$$,LEGAL,,PEP,Prosecutor-General of Qom,.,.,
1601739,HABIBI,Mohammad Reza,Mohammad Reza Habibi,2&M&M7$$$$$$$$$B&2&B&8$$$$$,LEGAL,,PEP,Deputy Prosecutor of Isfahan,.,.,
1601748,HEJAZI,Mohammad,Mohammad Hejazi,2&F&47$$$$$$$$$B&2&B&8$$$$$,INDIVIDUAL,,PEP,Head of the IRGC's Sarollah Corps (Tehran),.,1956:00:00,Isfahan; Ispahan
1608192,STAVYTSKY,Eduard Anatoliyovych,Eduard Anatoliyovych Stavytsky,4~&M&~437$$$$$$_8$$$$$$$$$$,POLITICAL INDIVIDUAL,,PEP,Former Minister of Fuel and Energy of Ukraine,.,1972:10:00,"Lebedyn, Ukraine; alt. POB Lebedyn, Sumy Region, Ukraine; alt. POB Lebedyn, Sumy oblast"
1625066,AL-AHMAD,Jumah,Jumah Al-Ahmad,&W&B&8$$$$$$$$$C&B&$$$$$$$$,MILITARY,Major General,,Commander Special Forces,.,.,
1625088,AL-ALI,Lu'ai,Lu'Ai Al-Ali,&W&W7$$$$$$$$$$W#$$$$$$$$$$,MILITARY,Colonel,,"Head of Syrian Military Intelligence, Dara'a Branch",.,.,
1625089,TAWIL,Fu'ad,Fu'Ad Tawil,~&&&W$$$$$$$$$$G#$$$$$$$$$$,MILITARY,Major General,PEP,Deputy head Syrian Air Force Intelligence,.,.,
1625100,AYYUB,Ali Abdullah,Ali Abdullah Ayyub,&&&M$$$$$$$$$$$&W7$$$$$$$$$,MILITARY,Lt Gen,,Deputy Chief of General Staff (Personnel and Manpower),.,.,
1625108,AL-FURAYJ,Jasim,Jasim Al-Furayj,&WM&Y&&F$$$$$$$C&4&B$$$$$$$,MILITARY,General,PEP,Chief of General staff.,.,1950:01:00,"Hama, Syria"
1625110,TLASS,Tala Mustafa,Tala Mustafa Tlass,~W&4$$$$$$$$$$$~&W&$$$$$$$$,MILITARY,Lt Gen,PEP,Deputy Chief of General Staff,.,.,
1625114,ASLAN,Aus,Aus Aslan,&4W&B$$$$$$$$$$&$$$$$$$$$$$,MILITARY,General,PEP,Head of Batallion in the Republican Guard,.,1959:00:00,
1625124,BELAL,Ghassan,Ghassan Belal,M&W&W$$$$$$$$$$F&4&B$$$$$$$,MILITARY,General,,General in command of the 4th Division reserve bureau,.,.,
1625125,MAHMUD,Wajih,Wajih Mahmud,B&B&8$$$$$$$$$$L&F7$$$$$$$$,MILITARY,Major General,PEP,Commander 18th Armoured Division,.,.,
1625127,BERRI,Abdullah,Abdullah Berri,M&Y7$$$$$$$$$$$&M8&W&$$$$$$,INDIVIDUAL,,,Head of Berri family militia,.,.,
1625129,MOULHEM,Kifah,Kifah Moulhem,B&&W&B$$$$$$$$$3&M&$$$$$$$$,MILITARY,,PEP,Batallion Commander in the 4th Division,.,.,
1625138,CHAOUI,George,George Chaoui,J2&&&7$$$$$$$$$F_@Y$$$$$$$$,INDIVIDUAL,,,Member of Syrian electronic army,.,.,
1625142,NAZIH,,Nazih,P&47$$$$$$$$$$$$$$$$$$$$$$$,MILITARY,Major General,PEP,Deputy Director of General Intelligence Directorate,.,.,
