482029,INTERNATIONAL ISLAMIC RELIEF ORGANIZATION PHILIPPINES BRANCH OFFICE,,International Islamic Relief Organization Philippines Branch Office,#M&4$$$$$$$$$$$&4W&B&3$$$$$,TERRORISM,,,,.,.,
482037,SAHRAOUI,Nessim Ben Romdhane,Nessim Ben Romdhane Sahraoui,4&Y&&&7$$$$$$$$P&4&B$$$$$$$,TERRORISM,,,,.,1973:08:00,"Bizerta, Tunisia"
482039,ZOGHBAI,Merai,Merai Zoghbai,4&FM&7$$$$$$$$$B&Y&7$$$$$$$,TERRORISM,,,,.,1969:04:00,"Bengasi, Libya; Libya; Bendasi, Libya; Bengasi, Libyan Arab Jamahirya; Bendasi, Libyan Arab Jamahirya; Morocco; Libyan Arab Jamahirya; Bengasi, Libyan Arab Jamahiriya; Bendasi, Libyan Arab Jamahiriya; Marocco, Libyan Arab Jamahiriya"
487024,JAMI JAMI,,Jami Jami,C&B7$$$$$$$$$$$C&B7$$$$$$$$,MILITARY,Brigadier General,PEP,Branch Chief for Syrian Military Intelligence (SMI) (Dayr az-Zor),.,1954:06:00,"Jablah, Zama, Syria"
491925,MOGHADAM,Ismail Ahmadi,Ismail Ahmadi Moghadam,B&F&8&B$$$$$$$$&4B&&W$$$$$$,INDIVIDUAL,Chief,PEP,Senior Advisor for Security Affairs to the Chief of the Armed Forces General Staff,.,1961:00:00,"Tehran, Iran; Tehran (Iran)"
501030,BANK SADERAT IRAN,,Bank Saderat Iran,&Y&B$$$$$$$$$$$M&B3$$$$$$$$,BANK,,PEP,,.,.,
509966,PSHONKA,Artem Viktorovych,Artem Viktorovych Pshonka,4&B3&$$$$$$$$$$&Y~&B$$$$$$$,POLITICAL INDIVIDUAL,,PEP,Former Member of Parliament,.,1976:03:00,"Kramatorsk, Donetsk Region, Ukraine; Kramatorsk (Donetsk oblast); Kramatorsk, Donetsk oblast"
521509,SOLEIMANI,Qasem,Qasem Soleimani,4&W&B&B7$$$$$$$3&4&B$$$$$$$,TERRORISM,Major General,PEP,"Commander of Iranian Revolutionary Guard Corps, IRGC - Qods",.,1957:03:00,"Qom, Iran; Iran"
521510,SAFAVI,Yahya Rahim,Yahya Rahim Safavi,4&M&M7$$$$$$$$$#2&&$$$$$$$$,MILITARY,Major General,PEP,"Commander, IRGC (Pasdaran)",.,1952:00:00,"Esfahan, Iran; Isfahan, Iran"
524348,LUKASH,Olena Leonidivna,Olena Leonidivna Lukash,W&3&42$$$$$$$$$#W&B&$$$$$$$,POLITICAL INDIVIDUAL,,PEP,Former Minister of Justice,.,1976:11:00,"Rybnytsya, Moldova; Ribnita (Moldova); Ribnita, Moldova"
529842,VAHIDI,Ahmad,Ahmad Vahidi,V&2&87$$$$$$$$$&2B_$$$$$$$$,MILITARY,Brigadier General,PEP,Minister (MODAFL),.,1958:00:00,"Shiraz, Iran"
539017,REZAIE,Morteza,Morteza Rezaie,Y&4&7$$$$$$$$$$B&Y~&4&$$$$$,MILITARY,Brigadier General,PEP,Deputy Commander of Iranian Revolutionary Guard Corps,.,1956:00:00,
539020,ISLAMIC REVOLUTIONARY GUARD CORPS (IRGC)-QODS FORCE,,Islamic Revolutionary Guard Corps (Irgc)-Qods Force,G&Y4$$$$$$$$$$$$$$$$$$$$$$$,TERRORISM,,,,.,.,
539024,ZOLQADR,Mohammad Baqer,Mohammad Baqer Zolqadr,4&W3&8Y$$$$$$$$B&2&B&8$$$$$,POLITICAL INDIVIDUAL,General,PEP,"Iranian Revolutionary Guard Corps officer, Deputy Interior Minister for Security Affairs",.,.,
539075,DELOS REYES,Feliciano Semborio Jr,Feliciano Semborio Jr Delos Reyes,G&W&4&&B@$$$$$$4&BM&Y&$$$$$,TERRORISM,Ustadz,,,.,1963:11:00,"Arco, Lamitan, Basilan Province, Philippines; alt POB Arco, Lamitan, Basilan, Philippines"
540478,MOUMOU,Mohamed,Mohamed Moumou,B&&B&#$$$$$$$$$B&2&B&8$$$$$,TERRORISM,,,,.,1965:07:00,"Fez, Morocco"
540479,AL-BATHALI,Mubarak Mushakhas Sanad,Mubarak Mushakhas Sanad Al-Bathali,&WM&~2&W7$$$$$$B&M&Y&3$$$$$,TERRORISM,,,,.,1961:10:00,Kuwait
540480,AL-JALAMAH,Jaber,Jaber Al-Jalamah,&WF&W&B&$$$$$$$C&M&Y$$$$$$$,TERRORISM,,,,.,1959:09:00,"Al-Khitan area, Kuwait"
540484,SALIMI,Hosein,Hosein Salimi,4&W&B7$$$$$$$$$2&4&B$$$$$$$,MILITARY,General,PEP,"Commander of the Air Force, IRGC (Pasdaran)",.,.,
540485,ZAHEDI,Mohammed Reza,Mohammed Reza Zahedi,4&2&87$$$$$$$$$B&2&B&8$$$$$,MILITARY,Brigadier General,PEP,Commander of Iranian Revolutionary Guard Corps Ground Forces,.,1944:00:00,"Esfahan, Iran; Isfahan, Iran"
545288,FAZLULLAH,Maulana,Maulana Fazlullah,G&4W&W&$$$$$$$$B&&W&B&$$$$$,TERRORISM,Maulana,,,.,1974:00:00,"Swat, Pakistan; Kuza Bandai village, Pakistan; Kuza Bandai village, Swat Valley, Khyber Pakhtunkhawa Province, Pakistan; Kuza Bandai Village, Swat Valley, Khyber Pakhtunkhwa Province, Pakistan"
548011,AL GHABRA,Mohammed,Mohammed Al Ghabra,&WF&MY&$$$$$$$$B&2&B&8$$$$$,TERRORISM,,,,.,1980:06:00,"Damascus, Syria; Damascus, Syrian Arab Republic"
548044,PSHONKA,Viktor Pavlovych,Viktor Pavlovych Pshonka,4&B3&$$$$$$$$$$V&3~&Y$$$$$$,LEGAL,,PEP,Former Prosecutor General of Ukraine,.,1954:02:00,"Serhiyivka, Donetsk Region, Ukraine; Serhiyivka (Donetsk oblast); Serhiyivka, Donetsk oblast"
548050,DASTJERDI,Ahmad Vahid,Ahmad Vahid Dastjerdi,8&4~F&Y87$$$$$$&2B_$$$$$$$$,INDIVIDUAL,,PEP,Head of the AIO,.,1954:01:00,
548051,ESMAELI,Reza-Gholi,Reza-Gholi Esmaeli,F&W7$$$$$$$$$$$&4B&&W7$$$$$,INDIVIDUAL,,PEP,"Head of Department;Head of Trade & International Affairs Dept, Aerospace Industries Organisation (AIO)",.,1961:04:00,"Tehran, Iran"
548052,BAHMANYAR,Bahmanyar Morteza,Bahmanyar Morteza Bahmanyar,M&B&B&&Y$$$$$$$M&B&B&&$$$$$,INDIVIDUAL,,PEP,"AIO Department Head;Head of Finance and Budget Department, AIO",.,1952:12:00,"Tehran, Iran"
548056,NOURI,Mohammad Mehdi Nejad,Mohammad Mehdi Nejad Nouri,P&&Y7$$$$$$$$$$B&2&B&8$$$$$,MILITARY,Lt Gen,PEP,Rector of Malek Ashtar University of Defence Technology,.,.,
548057,KALAYE ELECTRIC COMPANY,,Kalaye Electric Company,&W&3~Y&3$$$$$$$3&W&$$$$$$$$,CORPORATE,,PEP,,.,.,
548059,FARAYAND TECHNIQUE,,Farayand Technique,~&J2B&3$$$$$$$$G&Y&&&B$$$$$,CORPORATE,,PEP,,.,.,
548060,7TH OF TIR,,7Th Of Tir,I~2$$$$$$$$$$$$~$$$$$$$$$$$,CORPORATE,,PEP,,.,.,
548061,FAJR INDUSTRIES GROUP,,Fajr Industries Group,G&FY$$$$$$$$$$$$$$$$$$$$$$$,CORPORATE,,PEP,,.,.,
553038,DERAKHSHANDEH,Ahmad,Ahmad Derakhshandeh,8&Y&342&B8$$$$$&2B_$$$$$$$$,INDIVIDUAL,,,Chairman and Managing Director of Bank Sepah,.,1956:08:00,Iran
557032,GADDAFI INTERNATIONAL CHARITY AND DEVELOPMENT FOUNDATION,,Gaddafi International Charity And Development Foundation,G&&B8&~&&B$$$$$J2&Y&~7$$$$$,ORGANISATION,,PEP,,.,.,
558702,MUHAMMAD,Sirajuddin Haqqani Jalaluddin Khwasa,Sirajuddin Haqqani Jalaluddin Khwasa Muhammad,B&2&B&8$$$$$$$$4&Y&F&8$$$$$,TERRORISM,,,Na'ib Amir (Deputy Commander),.,1977:00:00,"Danda, Miramshah, Afghanistan; alt POB's Danda, Miramshah, North Waziristan, Pakistan; Srana Village, Garda Saray District, Paktya Province, Afghanistan; Neka District, Paktika, Afghanistan; Khowst Province, Afghanistan; Khost Province, Afghanistan"
558704,HAQQANI NETWORK,,Haqqani Network,P&~L&Y3$$$$$$$$2&3&B7$$$$$$,TERRORISM,,,,.,.,
559488,AL-DARI,Muthanna Harith,Muthanna Harith Al-Dari,&W8&Y7$$$$$$$$$B&~2&B&$$$$$,TERRORISM,Doctor,,,.,1969:06:00,Iraq
559784,AL NAGGAR,Shahinaz Abdel Aziz Abdel Wahab,Shahinaz Abdel Aziz Abdel Wahab Al Naggar,P&F&Y$$$$$$$$$$42&2&B&$$$$$,POLITICAL INDIVIDUAL,Dr,PEP,Former Member of Parliament,.,1969:10:00,"Al Giza, Egypt"
584099,IRAN COMMUNICATION INDUSTRIES,,Iran Communication Industries,&Y&B$$$$$$$$$$$$$$$$$$$$$$$,CORPORATE,,PEP,,.,.,
584124,NIRU BATTERY MANUFACTURING COMPANY,,Niru Battery Manufacturing Company,M&~&Y7$$$$$$$$$P&Y#$$$$$$$$,CORPORATE,,PEP,,.,.,
584127,MIZAN MACHINE MANUFACTURING GROUP,,Mizan Machine Manufacturing Group,BJ2&B$$$$$$$$$$B&4&B$$$$$$$,CORPORATE,,PEP,,.,.,
588146,ABBASI-DAVANI,Fereidoun,Fereidoun Abbasi-Davani,8&M&B7$$$$$$$$$G&Y&8&&$$$$$,POLITICAL INDIVIDUAL,,PEP,Senior Ministry of Defence official,.,1958:00:00,"Abadan, Iran"
588147,AHMADIAN,Ali Akbar,Ali Akbar Ahmadian,&B&8&&B$$$$$$$$&W7$$$$$$$$$,MILITARY,Vice Admiral,PEP,Chief of Iranian Revolutionary Guard Corps Joint Staff,.,1961:00:00,"Kerman, Iran"
588148,FAKHRIZADEH-MAHABADI,Mohsen,Mohsen Fakhrizadeh-Mahabadi,B&2&M&87$$$$$$$B&4&B$$$$$$$,INDIVIDUAL,,PEP,Senior MODAFL Scientist,.,.,
588149,HEJAZI,Mohammad,Mohammad Hejazi,2&F&47$$$$$$$$$B&2&B&8$$$$$,MILITARY,Brigadier General,PEP,Commander of Bassij resistance force,.,1959:00:00,"Isfahan, Iran"
588150,HOJATI,Mohsen,Mohsen Hojati,2&F&~7$$$$$$$$$B&4&B$$$$$$$,INDIVIDUAL,,PEP,Head of Fajr Industrial Group,.,1955:09:00,"Najafabad, Iran"
588151,KETABACHI,Mehrdada Akhlaghi,Mehrdada Akhlaghi Ketabachi,3&~&M&J27$$$$$$B&Y8&8&$$$$$,INDIVIDUAL,,PEP,Head of Shahid Bagheri Industrial Group,.,1958:09:00,
588153,MALEKI,Naser,Naser Maleki,B&W&37$$$$$$$$$P&4&Y$$$$$$$,INDIVIDUAL,,PEP,Head of Shahid Hemmat Industrial Group,.,1960:00:00,
588154,SAFARI,Morteza,Morteza Safari,4&M&Y7$$$$$$$$$B&Y~&4&$$$$$,MILITARY,Rear Admiral,PEP,Commander of Iranian Revolutionary Guard Corps Navy,.,.,
588156,AMMUNITION AND METALLURGY INDUSTRIES GROUP,,Ammunition And Metallurgy Industries Group,B&~&W&YF7$$$$$$&B&B&~&$$$$$,CORPORATE,,PEP,,.,.,
588157,SHO'A' AVIATION,,Sho'A' Aviation,&M&&~&&B$$$$$$$42&&$$$$$$$$,CORPORATE,,PEP,,.,.,
588158,QODS AERONAUTICS INDUSTRIES,,Qods Aeronautics Industries,&&Y&B&&~&3$$$$$3&8$$$$$$$$$,CORPORATE,,PEP,,.,.,
588159,PARS AVIATION SERVICES COMPANY,,Pars Aviation Services Company,&M&&~&&B$$$$$$$N&Y$$$$$$$$$,CORPORATE,,PEP,,.,.,
588160,PARCHIN CHEMICAL INDUSTRIES,,Parchin Chemical Industries,N&YJ2&B$$$$$$$$$$$$$$$$$$$$,CORPORATE,,PEP,,.,.,
588164,NAVAL DEFENCE MISSILE INDUSTRY GROUP,,Naval Defence Missile Industry Group,B&4&W$$$$$$$$$$$$$$$$$$$$$$,CORPORATE,,PEP,,.,.,
593350,KOVALCHUK,Yuri Valentinovich,Yuri Valentinovich Kovalchuk,3&M&WJ2&3$$$$$$#Y7$$$$$$$$$,DIPLOMAT,,PEP,Chairman of Bank Rossiya,.,1951:07:00,"Saint Petersburg, Russia; Leningrad (St Petersburg), Russian Federation; Leningrad (St Petersburg); St. Petersburg (f.k.a. Leningrad), Russian Federation"
594231,MUKULU,Jamil,Jamil Mukulu,B&3&W#$$$$$$$$$C&B&W$$$$$$$,TERRORISM,Commander,,Head/Commander of the Allied Democratic Forces,.,1965:00:00,"Kayunga, Uganda; Ntoke Village, Ntenjeru Sub County, Kayunga District, Uganda"
594245,MUSONI,Straton,Straton Musoni,B&4&B7$$$$$$$$$4~Y&~&B$$$$$,TERRORISM,,,,.,1961:04:00,"Mugambazi, Kigali, Rwanda; MUGABANZI, KIGALI, Rwanda"
594253,UGANDA COMMERCIAL IMPEX,,Uganda Commercial Impex,&BM&X$$$$$$$$$$#F&P8&$$$$$$,CORPORATE,,,,.,.,
594254,MACHANGA LTD,,Machanga Ltd,BJ2&BF&$$$$$$$$$$$$$$$$$$$$,CORPORATE,,,,.,.,
594255,CONGOCOM TRADING HOUSE,,Congocom Trading House,2&&4$$$$$$$$$$$3&BF&3&$$$$$,CORPORATE,,,,.,.,
594256,COMPAGNIE AERIENNE DES GRANDS LACS,,Compagnie Aerienne Des Grands Lacs,W&34$$$$$$$$$$$3&BM&FB$$$$$,CORPORATE,,,,.,.,
594257,COMPAGNIE AERIENNE DES GRANDS LACS,,Compagnie Aerienne Des Grands Lacs,W&34$$$$$$$$$$$3&BM&FB$$$$$,CORPORATE,,,,.,.,
594260,GREAT LAKES BUSINESS COMPANY,,Great Lakes Business Company,W&3$$$$$$$$$$$$FY&~$$$$$$$$,CORPORATE,,,,.,.,
594261,GREAT LAKES BUSINESS COMPANY,,Great Lakes Business Company,W&3$$$$$$$$$$$$FY&~$$$$$$$$,CORPORATE,,,,.,.,
594262,AL-QA'IDA IN THE ARABIAN PENINSULA,,Al-Qa'Ida In The Arabian Peninsula,N&B&B4&W&$$$$$$3&&8&$$$$$$$,TERRORISM,,,,.,.,
599145,AL-QA'IDA IN THE ARABIAN PENINSULA,,Al-Qa'Ida In The Arabian Peninsula,N&B&B4&W&$$$$$$3&&8&$$$$$$$,TERRORISM,,,,.,.,
599153,IRAN ELECTRONICS INDUSTRIES,,Iran Electronics Industries,&W&3~Y&B&3$$$$$&Y&B$$$$$$$$,CORPORATE,,PEP,,.,.,
599160,ARMY SUPPLY BUREAU,,Army Supply Bureau,M&Y&&#$$$$$$$$$$$$$$$$$$$$$,CORPORATE,,PEP,,.,.,
599161,SYRIAN MINISTRY OF DEFENCE,,Syrian Ministry Of Defence,B&B&4~Y7$$$$$$$4&Y&&B$$$$$$,ORGANISATION,,PEP,,.,.,
599262,IMAMOVIC,Nusret,Nusret Imamovic,&B&B&M&3$$$$$$$P&4Y&~$$$$$$,TERRORISM,,,,.,1971:09:00,"Miljanovci, Kalesija Municipality, Bosnia; Lipovice,Kalesija Municipality,Bosnia and Herzegovina"
599569,SYRIAN ARAB AIRLINES,,Syrian Arab Airlines,&&YW&B$$$$$$$$$4&Y&&B$$$$$$,TERRORISM,,PEP,,.,.,
601997,KOREA NATIONAL INSURANCE CORPORATION (KNIC),,Korea National Insurance Corporation (Knic),$$$$$$$$$$$$$$$&B4&Y&B$$$$$,CORPORATE,,PEP,,.,.,
602001,RI,Je-Son,Je-Son Ri,C_$$$$$$$$$$$$$$$$$$$$$$$$$,POLITICAL INDIVIDUAL,,PEP,Minister of Atomic Energy Industry,.,1938:00:00,
603164,SOLAT SANA,Abdollah,Abdollah Solat Sana,4&B&$$$$$$$$$$$&M8&W&$$$$$$,INDIVIDUAL,,PEP,Managing Director (UCF),.,.,
605166,TEHRIK-E TALIBAN PAKISTAN (TTP),,Tehrik-E Taliban Pakistan (Ttp),N&3&4~&B$$$$$$$~&Y&3$$$$$$$,TERRORISM,,,,.,.,
605210,ARMAMENT INDUSTRIES GROUP,,Armament Industries Group,&YB&B&B~$$$$$$$$$$$$$$$$$$$,CORPORATE,,PEP,,.,.,
605211,DEFENSE TECHNOLOGY AND SCIENCE RESEARCH CENTER,,Defense Technology And Science Research Center,4&B~&Y$$$$$$$$$8&M&B4$$$$$$,ORGANISATION,,PEP,,.,.,
605216,MARINE INDUSTRIES ORGANIZATION,,Marine Industries Organization,#YF&B&4&~&$$$$$$$$$$$$$$$$$,CORPORATE,,PEP,,.,.,
605219,SPECIAL INDUSTRIES GROUP,,Special Industries Group,$$$$$$$$$$$$$$$$$$$$$$$$$$$,CORPORATE,,PEP,,.,.,
610091,ACCION NACIONALISTA VASCA,,Accion Nacionalista Vasca,V&43&$$$$$$$$$$&J2&&B$$$$$$,TERRORISM,,PEP,,.,.,
610115,AL-SHABAAB,,Al-Shabaab,&W42&M&M$$$$$$$$$$$$$$$$$$$,TERRORISM,,,,.,.,
610117,AW-MOHAMED,Ahmed Abdi,Ahmed Abdi Aw-Mohamed,B&2&B&8$$$$$$$$&2B_$$$$$$$$,TERRORISM,Shaykh,,,.,1977:07:00,"Hargeysa, Somalia"
610568,VOROBIOV,Yuri Leonidovich,Yuri Leonidovich Vorobiov,V&Y&M&&M$$$$$$$#Y7$$$$$$$$$,POLITICAL INDIVIDUAL,,PEP,Deputy Speaker of the Federation Council of the Russian Federal,.,1948:02:00,"Krasnoyarsk, Krasnoyarsk Territory, Russian Federation; Krasnoyarsk"
620166,KHALAF,Fuad Mohamed,Fuad Mohamed Khalaf,3&W&M$$$$$$$$$$G&&8$$$$$$$$,INDIVIDUAL,Sheikh,,,.,1965:03:00,"Mogadishu, Somalia"
626452,ABD AL-KHALIQ,Adil Muhammad Mahmud,Adil Muhammad Mahmud Abd Al-Khaliq,&W3&W&3$$$$$$$$&8&W$$$$$$$$,TERRORISM,,,,.,1984:03:00,Bahrain
631144,BORTNIKOV,Aleksandr Vasilievich,Aleksandr Vasilievich Bortnikov,M&Y~B&3&M$$$$$$&W_X$$$$$$$$,INDIVIDUAL,General of the Army,PEP,Director of the Federal Security Service (FSB),.,1951:11:00,"Perm; Perm, Perm Territory, Russian Federation"
632592,AL-SUBAIY,Khalifa Muhammad Turki,Khalifa Muhammad Turki Al-Subaiy,&W4&M&7$$$$$$$$3&W&M&$$$$$$,TERRORISM,,,,.,1965:01:00,"Doha, Qatar"
635369,KHAN,Mustafa Hajji Muhammad,Mustafa Hajji Muhammad Khan,3&B$$$$$$$$$$$$B&4~&M&$$$$$,TERRORISM,,,,.,1977:08:00,"Madinah, Saudi Arabia; Sangrar, Sindh Province, Pakistan, Al-Madinah, Saudi Arabia; Sangrar, Sindh Province, Pakistan"
637089,SHARIF UNIVERSITY OF TECHNOLOGY,,Sharif University Of Technology,#B&M&Y4&~7$$$$$42&Y&M$$$$$$,ORGANISATION,,PEP,,.,.,
638861,NEDA INDUSTRIAL GROUP,,Neda Industrial Group,P&8&$$$$$$$$$$$$$$$$$$$$$$$,CORPORATE,,,,.,.,
639291,ISLAMIC REVOLUTIONARY GUARD CORPS,,Islamic Revolutionary Guard Corps,3&YM$$$$$$$$$$$&4W&B&3$$$$$,ORGANISATION,,,,.,.,
639608,ALLAW,Sufian,Sufian Allaw,&W&#$$$$$$$$$$$4&M&&B$$$$$$,POLITICAL INDIVIDUAL,,PEP,Former Minister for Oil and Mineral Resources,.,1944:00:00,"Bu Kamal, Syria; Alt POB: al-Bukamal, Deir Ezzor; al-Bukamal, Deir Ezzor, Syrian Arab Republic"
640683,FARZAT,Hussein Mahmoud,Hussein Mahmoud Farzat,G&Y4&~$$$$$$$$$2&4&B$$$$$$$,POLITICAL INDIVIDUAL,,PEP,Minister of State,.,1957:00:00,"Hama, Syria; Hama; Hama, Syrian Arab Republic"
640685,AL-SARI,Hassan,Hassan Al-Sari,&W4&Y7$$$$$$$$$2&4&B$$$$$$$,POLITICAL INDIVIDUAL,,PEP,Former Minister of State,.,1953:00:00,"Hama, Syria; alt POB: Hama; Hama, Syrian Arab Republic"
640686,SWEID,Joseph Jurji,Joseph Jurji Sweid,4L&8$$$$$$$$$$$C@_$$$$$$$$$,POLITICAL INDIVIDUAL,,PEP,Minister of State,.,1958:00:00,"Damascus, Qeymeriya, Syria; Damascus; Damascus, Syrian Arab Republic"
641820,HYON,Chol-hae,Chol-Hae Hyon,2&&B$$$$$$$$$$$J2&W&$$$$$$$,MILITARY,General,PEP,Deputy Director,.,1934:00:00,"Manchuria,China"
642089,AL-DIBISKI,Nur Al-Din,Nur Al-Din Al-Dibiski,&W8&M&437$$$$$$P$$$$$$$$$$$,TERRORISM,,,,.,1963:00:00,"Tripoli, Libya;Alt POB Tripoli, Libyan Arab Jamahiriya"
642090,AZIZAH,Sa'id Yusif Ali Abu,Sa'Id Yusif Ali Abu Azizah,&4&4&$$$$$$$$$$#4&M$$$$$$$$,TERRORISM,,,,.,1958:00:00,"Tripoli, Libya;Tripoli, Libyan Arab Jamahiriya"
642091,AL-SAYYID,'Ali Sulayman Mas'ud 'Abd,'Ali Sulayman Mas'Ud 'Abd Al-Sayyid,&W4&&&8$$$$$$$$#8&M8$$$$$$$,TERRORISM,,,,.,1969:00:00,"Tripoli, Libya;Alt POB Tripoli, Libyan Arab Jamahiriya"
659134,GAZIYEV,Tarkhan Ismailovich,Tarkhan Ismailovich Gaziyev,F&4&&&M$$$$$$$$~&Y3&B$$$$$$,TERRORISM,,,,.,1965:11:00,"Itum-Kale District, Chechen Ingush; Chechen Republic, Russia; Bugaroy Village, Itum-Kalinskiy District, Republic of Chechnya, Russian Federation; Itum-Kale, Chechen Republic, Russian Federation; Pozh-Poroy, Chechen Republic, Russian Federation"
661974,HAMSHO,Muhammad,Muhammad Hamsho,2&B42@$$$$$$$$$B&2&B&8$$$$$,POLITICAL INDIVIDUAL,,PEP,Member of Parliament,.,1966:05:00,"Damascus, Syria"
661990,GHAZAL,Mohammad Walid,Mohammad Walid Ghazal,F&4&W$$$$$$$$$$B&2&B&8$$$$$,POLITICAL INDIVIDUAL,,PEP,Minister of Housing and Urban Development,.,1951:00:00,"Aleppo; Aleppo, Syrian Arab Republic"
662041,AL HOUTHI,Abdul Malik,Abdul Malik Al Houthi,&W&&~27$$$$$$$$&M8#$$$$$$$$,TERRORISM,,,Leader of Yemen's Houthi Movement,.,1982:00:00,"Dahyan Governorate, Yemen"
666508,AHMAD AL-ABDULLAH,Subhi,Subhi Ahmad Al-Abdullah,&W&M8&W&$$$$$$$4&M7$$$$$$$$,POLITICAL INDIVIDUAL,,PEP,Minister of Agriculture and Agrarian Reform,.,1951:00:00,"Idleb, Sryia;Idleb, Syria"
670732,MURADOV,Georgiy L'vovich,Georgiy L'Vovich Muradov,F&&YF7$$$$$$$$$WM&M&3$$$$$$,POLITICAL INDIVIDUAL,,PEP,Deputy Prime Minister of Crimea,.,1954:11:00,"Kochmes, Komi Republic, Russian Federation; Komi Republic; Kochmes, Komi ASSR; Kochmes, Komi Republic"
674648,KIM,Yong Chol,Yong Chol Kim,3&B$$$$$$$$$$$$J2&W$$$$$$$$,MILITARY,Lieutenant General,PEP,Commander of Reconnaissance General Bureau (RGB),.,1947:00:00,"Pyongan-Pukto, North Korea; Alt POB: Pyongan-Pukto, Democratic People's Republic of Korea"
677095,DJOUADI,Yahia,Yahia Djouadi,8F&&&87$$$$$$$$#2&&$$$$$$$$,TERRORISM,,,,.,1967:01:00,"M'Hamid, Wilaya (province) of Sidi Bel Abbes, Algeria; M'Hamid, Sidi Bel Abbas, Algeria"
687190,KHATAM OL ANBIA GHARARGAH SAZANDEGI NOOH,,Khatam Ol Anbia Gharargah Sazandegi Nooh,P&@$$$$$$$$$$$$3&~&B$$$$$$$,TERRORISM,,PEP,,.,.,
687194,JAVANI,Yadollah,Yadollah Javani,C&M&B7$$$$$$$$$#8&W&$$$$$$$,TERRORISM,Dr,PEP,Advisor to the Supreme Leader's representative to the IRGC,.,1956:00:00,"Isfahan; Isfahan, Iran"
692046,MAHSOULI,Sadeq,Sadeq Mahsouli,B&4&&W7$$$$$$$$4&8&3$$$$$$$,POLITICAL INDIVIDUAL,,PEP,Former Minister of the Interior and Deputy Commander-in-Chief of the Armed Forces for Law Enforcement;Minister of Welfare and Social Security,.,1959:00:00,"Orumieh, Iran; Oroumieh (Iran); Oroumieh, Iran"
695262,SALEH,Bachir,Bachir Saleh,4&W$$$$$$$$$$$$M&J2&Y$$$$$$,POLITICAL INDIVIDUAL,,PEP,Head of Cabinet of Muammar Qadhafi,.,1946:00:00,"Traghen, Libya; Traghen"
698111,MAHMOUD,Ali Habib,Ali Habib Mahmoud,B&B&&8$$$$$$$$$&W7$$$$$$$$$,POLITICAL INDIVIDUAL,Lieutenant General,PEP,Minister of Defense,.,1939:00:00,"Tartous, Syria; Tartous; Tartous, Syrian Arab Republic"
702035,GELOWICZ,Fritz Martin,Fritz Martin Gelowicz,F&W&L&34$$$$$$$GY&~4$$$$$$$,TERRORISM,,,,.,1979:09:00,"Munich, Germany; Liege, Belgium;Liège, Belgium; München, Germany"
702041,YILMAZ,Adem,Adem Yilmaz,#WB&4$$$$$$$$$$&8&B$$$$$$$$,TERRORISM,,,,.,1978:11:00,"Bayburt, Turkey"
707008,SELEK,Atilla,Atilla Selek,4&W&3$$$$$$$$$$&~&W&$$$$$$$,TERRORISM,,,,.,1985:02:00,"Ulm, Germany"
727024,AL-KHASHIBAN,Fahd Muhammad 'Abd Al-'Aziz,Fahd Muhammad 'Abd Al-'Aziz Al-Khashiban,3&42&M&B$$$$$$$G&8$$$$$$$$$,TERRORISM,,,,.,1966:10:00,"Aniza, Saudi Arabia;alt POB Oneiza, Saudi Arabia; ONEIZA , Saudi arabia"
727031,AL-TALHI,Abdul Rahim,Abdul Rahim Al-Talhi,&W~&W7$$$$$$$$$&M8#$$$$$$$$,TERRORISM,,,,.,1961:12:00,"Al-Taif, Saudi Arabia; Al-Shefa, Al-Taif, Saudi Arabia"
734184,SEPASAD ENGINEERING COMPANY,,Sepasad Engineering Company,&BF&B&Y&BF$$$$$4&M&4&8$$$$$,CORPORATE,,PEP,,.,.,
734185,SAHEL CONSULTANT ENGINEERS,,Sahel Consultant Engineers,&BF&B&Y$$$$$$$$4&2&W$$$$$$$,CORPORATE,,PEP,,.,.,
734187,ORIENTAL OIL KISH,,Oriental Oil Kish,3&42$$$$$$$$$$$#Y&&B~&$$$$$,CORPORATE,,PEP,,.,.,
734188,ORIENTAL OIL KISH,,Oriental Oil Kish,3&42$$$$$$$$$$$#Y&&B~&$$$$$,CORPORATE,,PEP,,.,.,
734189,OMRAN SAHEL,,Omran Sahel,4&2&W$$$$$$$$$$#BY&B$$$$$$$,CORPORATE,,PEP,,.,.,
734190,MINISTRY OF DEFENSE FOR ARMED FORCES LOGISTICS,,Ministry Of Defense For Armed Forces Logistics,B&B&4~Y7$$$$$$$8&M&B4$$$$$$,CORPORATE,,PEP,,.,.,
734224,GHARARGAHE SAZANDEGI GHAEM,,Gharargahe Sazandegi Ghaem,F&&B$$$$$$$$$$$F&Y&YF&$$$$$,CORPORATE,,PEP,,.,.,
734225,GHORB KARBALA,,Ghorb Karbala,3&YM&W&$$$$$$$$F&YM$$$$$$$$,CORPORATE,,PEP,,.,.,
734226,GHORB NOOH,,Ghorb Nooh,P&@$$$$$$$$$$$$F&YM$$$$$$$$,CORPORATE,,PEP,,.,.,
734227,HARA COMPANY,,Hara Company,2&Y&$$$$$$$$$$$$$$$$$$$$$$$,CORPORATE,,,,.,.,
734718,HAQQANI,Nasiruddin,Nasiruddin Haqqani,2&3&B7$$$$$$$$$P&4&Y&8$$$$$,TERRORISM,Dr,,,.,1972:00:00,"Afghanistan; alt POB: Neka District, Paktika Province, Afghanistan"
742051,MAKHLUF,Hafiz,Hafiz Makhluf,B&3W&M$$$$$$$$$2&M&4$$$$$$$,MILITARY,Colonel,PEP,"Colonel and Head of Unit in General Intelligence Directorate, Damascus Branch",.,1975:00:00,"Damascus, Syria; alt POB Damascus; Damascus, Syrian Arab Republic"
753663,LIZASO,Jurdan Martitegui,Jurdan Martitegui Lizaso,W&4&4@$$$$$$$$$C&Y8&B$$$$$$,TERRORISM,,,,.,1980:05:00,"Durango, Vizcaya, Spain; alt POB Durango (Vizcaya); alt POB Durango, Biscay, Spain"
759294,ABDUL RAHMAN,Muhammad Jibril,Muhammad Jibril Abdul Rahman,Y&B&B$$$$$$$$$$B&2&B&8$$$$$,TERRORISM,,,,.,1984:05:00,"East Lombok, West Nusa Tenggara, Indonesia; alt. POB Lombok Timur, Indonesia"
759619,YARZA,Aitzol Iriondo,Aitzol Iriondo Yarza,#Y4&$$$$$$$$$$$&&~4&W$$$$$$,TERRORISM,,,,.,1977:03:00,"San Sebastina, Guipuzcoa, Spain; alt. POB San Sebastián, Guipúzcoa, Spain;San Sebastián (Guipúzcoa); an Sebastian, Spain; San Sebastian, Spain"
762004,SUKIRNO,Bambang,Bambang Sukirno,4&3&YB@$$$$$$$$M&BM&BF$$$$$,TERRORISM,,,Senior leader of Jemaah Islamiyah,.,1975:04:00,Indonesia
779706,IRAN AIRCRAFT MANUFACTURING INDUSTRIAL COMPANY,,Iran Aircraft Manufacturing Industrial Company,&&Y3Y&M~$$$$$$$&Y&B$$$$$$$$,CORPORATE,,PEP,,.,.,
782397,KOREA HEUNGJIN TRADING COMPANY,,Korea Heungjin Trading Company,2&&BF&B$$$$$$$$3&Y&&$$$$$$$,CORPORATE,,,,.,.,
782404,KOREA DAESONG GENERAL TRADING CORPORATION,,Korea Daesong General Trading Corporation,8&&4&BF$$$$$$$$3&Y&&$$$$$$$,CORPORATE,,PEP,,.,.,
782411,KOREA TANGUN TRADING CORPORATION,,Korea Tangun Trading Corporation,~&BF&B$$$$$$$$$3&Y&&$$$$$$$,CORPORATE,,PEP,,.,.,
782413,KOREA HYOKSIN TRADING CORPORATION,,Korea Hyoksin Trading Corporation,2&&34&B$$$$$$$$3&Y&&$$$$$$$,CORPORATE,,PEP,,.,.,
782425,SOBAEKU UNITED CORP,,Sobaeku United Corp,4&M&&3#$$$$$$$$#B&~&8$$$$$$,CORPORATE,,PEP,,.,.,
782429,MECHANICAL CONSTRUCTION FACTORY,,Mechanical Construction Factory,3&B4~Y&3~&$$$$$$$$$$$$$$$$$,CORPORATE,,PEP,,.,.,
784227,BATASUNA,,Batasuna,M&~&4&B&$$$$$$$$$$$$$$$$$$$,TERRORISM,,PEP,,.,.,
785344,EUSKAL HERRITARROK,,Euskal Herritarrok,2&Y&~&Y&3$$$$$$&&43&W$$$$$$,TERRORISM,,,,.,.,
786121,SHIRAZ ELECTRONICS INDUSTRIES,,Shiraz Electronics Industries,&W&3~Y&B&3$$$$$42&Y&4$$$$$$,CORPORATE,,PEP,,.,.,
791647,IYAMUREMYE,Gaston,Gaston Iyamuremye,&&&B&Y&B7$$$$$$F&4~&B$$$$$$,POLITICAL INDIVIDUAL,Brigadier General,PEP,FDLR President,.,1948:00:00,"Musanze District (Northern Province) Rwanda; Nyakinama, Ruhengeri, Rwanda; Ruhengeri, Rwanda; Musanze District (Northern Province), Rwanda; MUSANZE DISTRICT, RWANDA; RUHENGERI, RWANDA, Rwanda; Musanze District, Northern Province, Rwanda; Musanze District"
792774,NTAWUNGUKA,Pacifique,Pacifique Ntawunguka,~&&BF&3&$$$$$$$N&4&M&3$$$$$,TERRORISM,Colonel,,Commander of FDLR 1st Division,.,1964:01:00,"Gaseke, Gisenyi Province, Rwanda; Gaseke, Western Province, Rwanda"
792776,MUGARAGU,Leodomir,Leodomir Mugaragu,B&F&Y&F#$$$$$$$W&&8&B&$$$$$,INDIVIDUAL,Brigadier General,,FDLR/FOCA Chief of Staff,.,1954:00:00,"Kigali, Rwanda; Rushashi (Northern Province), Rwanda; Rushashi, Northern Province, Rwanda"
792777,NZEYIMANA,Stanislas,Stanislas Nzeyimana,P4&&&B&B&$$$$$$4~P$$$$$$$$$,TERRORISM,Brigadier General,,Deputy Overall Commander FOCA,.,1966:01:00,"Mugusa (Butare), Rwanda; Mugusa, Butare, Rwanda"
793178,MUJAHID,Mohammed Yahya,Mohammed Yahya Mujahid,B&F&2&8$$$$$$$$B&2&B&8$$$$$,TERRORISM,,,,.,1961:03:00,"Lahore, Punjab Province, Pakistan; Sheikhupura, Pakistan"
793715,NSANZUBUKIRE,Felicien,Felicien Nsanzubukire,P4&B4&M&3&$$$$$G&W&4&&$$$$$,INDIVIDUAL,Lieutenant Colonel,,1st battalion leader of the FDLR-FOCA,.,1967:00:00,"Murama, Rwanda; Murama; Kinyinya; Rubungo; Kigali, Rwanda; Murama, Kigali, Rwanda; Rubungo, Kigali, Rwanda; Kinyinya, Kigali, Rwanda"
793722,MUJYAMBERE,Leopold,Leopold Mujyambere,B&F&&BM&Y$$$$$$W&&M&W8$$$$$,TERRORISM,Colonel,,,.,1962:03:00,"Kigali, Rwanda; Rulindo, Northern Province, Rwanda"
804808,CHERIF,Peter,Peter Cherif,J2&Y&M$$$$$$$$$N_~_$$$$$$$$,TERRORISM,,,,.,1982:01:00,"Paris, France; Paris, 20th district, France"
815547,ABZAR BORESH KAVEH CO,,Abzar Boresh Kaveh Co,3&M$$$$$$$$$$$$&M4&Y$$$$$$$,CORPORATE,,,,.,.,
815548,SAFETY EQUIPMENT PROCUREMENT COMPANY,,Safety Equipment Procurement Company,$$$$$$$$$$$$$$$$$$$$$$$$$$$,CORPORATE,,PEP,,.,.,
815549,BARZAGANI TEJARAT TAVANMAD SACCAL COMPANIES,,Barzagani Tejarat Tavanmad Saccal Companies,3&BM&B7$$$$$$$$M&Y4&F&$$$$$,CORPORATE,,PEP,,.,.,
815550,ELECTRO SANAM COMPANY,,Electro Sanam Company,&W&3~Y@$$$$$$$$4&B&B$$$$$$$,CORPORATE,,PEP,,.,.,
815551,ETTEHAD TECHNICAL GROUP,,Ettehad Technical Group,&~&2&8$$$$$$$$$$$$$$$$$$$$$,CORPORATE,,PEP,,.,.,
815552,JOZA INDUSTRIAL COMPANY,,Joza Industrial Company,C&4&$$$$$$$$$$$$$$$$$$$$$$$,CORPORATE,,PEP,,.,.,
815553,KHORASAN METALLURGY INDUSTRIES,,Khorasan Metallurgy Industries,B&~&W&YF7$$$$$$3&Y&4&B$$$$$,CORPORATE,,PEP,,.,.,
815579,ESLAMI,Mohammad,Mohammad Eslami,&4W&B7$$$$$$$$$B&2&B&8$$$$$,INDIVIDUAL,Dr,PEP,Head of Defence Industries Training and Research Institute,.,.,
816051,AL MAZIDIH,Akram Turki Hishan,Akram Turki Hishan Al Mazidih,&WB&4&87$$$$$$$&3Y&B$$$$$$$,TERRORISM,,,,.,1974:00:00,Akram Turki Al-Hishan
816053,AL MAZIDIH,Ghazy Fezza Hishan,Ghazy Fezza Hishan Al Mazidih,&WB&4&87$$$$$$$F&47$$$$$$$$,TERRORISM,,,,.,1974:00:00,
822027,INDUSTRIAL FACTORIES OF PRECISION (IFP) MACHINERY,,Industrial Factories Of Precision (Ifp) Machinery,BJ2&B&Y7$$$$$$$NY&4&4&$$$$$,CORPORATE,,,,.,.,
828035,ALI HAKIM,Boubaker Ben Habib Ben,Boubaker Ben Habib Ben Ali Hakim,2&3&B$$$$$$$$$$M&&M&3&$$$$$,TERRORISM,,,,.,1983:08:00,"Paris, France; Paris, Ile-de-France, France"
832497,MIZULINA,Yelena,Yelena Mizulina,B&4&W&B&$$$$$$$#W&B&$$$$$$$,POLITICAL INDIVIDUAL,Prof Dr,PEP,Member of the Federation Council from Omsk region,.,1954:12:00,"Bui, Kostroma, Russia; Bui, Kostroma Region, Russian Federation; Buly, Kostroma Oblast; Bui, Kostroma region; Bui, Kostroma Oblast; Bui, Kostroma Region"
